{
  "schema_version": "1",
  "stack": "django",
  "discovery_mode": "runtime",
  "coverage": "complete",
  "coverage_note": null,
  "base_script": {"stack": "django", "version": "0.1.0"},
  "boot_environment": {"entry": "config.settings.production", "environ": [{"name": "DJANGO_ENV", "value": "production", "reason": "production value; mounts no debug routes"}], "stubs": [{"target": "config.secrets.load", "reason": "secrets vault unreachable outside production"}], "pinned": [{"setting": "DEBUG", "value": false, "reason": "production value"}]},
  "project_dimensions": {"access_tier": ["public", "customer", "staff"]},
  "expected_access": {"access_tier": {"public": {"authentication": ["anonymous", "optional"], "authorization": ["none"]}, "staff": {"authentication": ["required"], "authorization": ["rule"]}}},
  "endpoints": [
    {"method": "GET", "path": "/admin/", "handler": "django.contrib.admin.sites.AdminSite.index", "authentication": {"value": "required", "layer": "global", "raw": "is_staff", "rule": "builtin:django_admin", "evidence": null}, "authorization": {"value": "rule", "layer": "global", "raw": "is_staff", "rule": "builtin:django_admin", "evidence": null}, "dimensions": {"access_tier": "staff"}, "unknown_reason": null, "acknowledged": false},
    {"method": "ANY", "path": "/api/health", "handler": "health/legacy.py:3", "authentication": {"value": "anonymous", "layer": "framework-default", "raw": null, "rule": "builtin:no_check", "evidence": null}, "authorization": {"value": "none", "layer": "framework-default", "raw": null, "rule": "builtin:no_check", "evidence": null}, "dimensions": {"access_tier": "public"}, "unknown_reason": null, "acknowledged": false},
    {"method": "ANY", "path": "/api/health", "handler": "health/views.py:8", "authentication": {"value": "anonymous", "layer": "method", "raw": "AllowAny", "rule": "builtin:AllowAny", "evidence": null}, "authorization": {"value": "none", "layer": "method", "raw": "AllowAny", "rule": "builtin:AllowAny", "evidence": null}, "dimensions": {"access_tier": "public"}, "unknown_reason": null, "acknowledged": false},
    {"method": "GET", "path": "/api/orders/{pk}/", "handler": "orders/views.py:21", "authentication": {"value": "optional", "layer": "class", "raw": "IsAuthenticatedOrReadOnly", "rule": "builtin:IsAuthenticatedOrReadOnly", "evidence": null}, "authorization": {"value": "none", "layer": "class", "raw": "IsAuthenticatedOrReadOnly", "rule": "builtin:IsAuthenticatedOrReadOnly", "evidence": null}, "dimensions": {"access_tier": "customer"}, "unknown_reason": null, "acknowledged": false},
    {"method": "POST", "path": "/api/orders/{pk}/", "handler": "orders/views.py:21", "authentication": {"value": "required", "layer": "class", "raw": "IsAuthenticatedOrReadOnly", "rule": "builtin:IsAuthenticatedOrReadOnly", "evidence": null}, "authorization": {"value": "none", "layer": "class", "raw": "IsAuthenticatedOrReadOnly", "rule": "builtin:IsAuthenticatedOrReadOnly", "evidence": null}, "dimensions": {"access_tier": "customer"}, "unknown_reason": null, "acknowledged": false},
    {"method": "GET", "path": "/api/reports/{slug}", "handler": "reports/views.py:40", "authentication": {"value": "required", "layer": "global", "raw": "TenantMiddleware", "rule": "recognition:tenant_middleware", "evidence": "config/middleware.py:12"}, "authorization": {"value": "unknown", "layer": "method", "raw": "IsOwner", "rule": null, "evidence": null}, "dimensions": {"access_tier": "customer"}, "unknown_reason": "IsOwner checks ownership in has_object_permission; not modelled", "acknowledged": true},
    {"method": "GET", "path": "/café/menu", "handler": "menu/views.py:5", "authentication": {"value": "anonymous", "layer": "framework-default", "raw": "AllowAny", "rule": "builtin:AllowAny", "evidence": null}, "authorization": {"value": "none", "layer": "framework-default", "raw": "AllowAny", "rule": "builtin:AllowAny", "evidence": null}, "dimensions": {"access_tier": "public"}, "unknown_reason": null, "acknowledged": false}
  ]
}
