{
  "schema_version": "1",
  "stack": "django",
  "discovery_mode": "runtime",
  "coverage": "complete",
  "coverage_note": null,
  "base_script": {"stack": "django", "version": "0.1.0"},
  "boot_environment": {"entry": "config.settings.production", "environ": [], "stubs": [], "pinned": []},
  "project_dimensions": {},
  "expected_access": {},
  "endpoints": []
}
